{"$schema":"https://json-schema.org/draft/2020-12/schema","type":"object","required":["chosen_hypothesis","alphabets","default_alphabet","glyph_regions","ignored_regions","confidence","rationale"],"properties":{"chosen_hypothesis":{"type":"integer"},"alphabets":{"type":"array"},"default_alphabet":{"type":"string"},"glyph_regions":{"type":"array","items":{"type":"object","required":["id","region_ids","bbox","role","confidence","rationale"],"properties":{"id":{"type":"string"},"region_ids":{"type":"array"},"bbox":{"type":"array"},"role":{"enum":["glyph","variant"]},"confidence":{"type":"number"},"rationale":{"type":"string"}}}},"ignored_regions":{"type":"array"},"confidence":{"type":"number"},"rationale":{"type":"string"}}}
